{
  "version": "0.1.0",
  "reviewed_at": "2026-03-26",
  "purpose": "Make the major public-surface decisions explicit so reviewers and contributors can see why the public specs repository is shaped the way it is.",
  "decisions": [
    {
      "id": "public-specs-surface-instead-of-full-runtime",
      "summary": "The repository is intentionally a public specs and contract surface, not a dump of the full private N1Hub runtime.",
      "rationale": "A narrow public projection is safer to review, easier to maintain, and more credible than exposing private runtime internals or operator state.",
      "strongest_surfaces": [
        "docs/repository-scope.md",
        "PUBLIC_BOUNDARY_MAP.json",
        "docs/projection-doctrine.md",
        "PUBLIC_LIMITATIONS_REGISTER.json"
      ],
      "supporting_surfaces": [
        "docs/reviewer-guide.md",
        "PUBLIC_ASSURANCE_CASE.json",
        "PUBLIC_RELEASE_REVIEW.md"
      ],
      "verify_commands": [
        "npm run check:boundary-map",
        "npm run check:limitations-register",
        "npm run check:decision-log"
      ],
      "bounded_non_goals": [
        "does not claim to expose the full private runtime",
        "does not promise that every internal domain is published here"
      ]
    },
    {
      "id": "stronger-sources-outrank-summaries",
      "summary": "Schemas, OpenAPI, raw capsules, provenance, and validator-backed checks outrank reviewer-friendly summaries.",
      "rationale": "Reviewer convenience layers are useful only if they remain subordinate to stronger contracts and verification surfaces.",
      "strongest_surfaces": [
        "PUBLIC_EVIDENCE_STRENGTH_MAP.json",
        "PUBLIC_TRACEABILITY_MATRIX.json",
        "PUBLIC_VERIFICATION_MATRIX.json",
        "PUBLIC_CONTRACT_CATALOG.json"
      ],
      "supporting_surfaces": [
        "docs/trust-model.md",
        "docs/traceability.md",
        "docs/release-evidence.md"
      ],
      "verify_commands": [
        "npm run check:evidence-strength",
        "npm run check:traceability",
        "npm run check:decision-log"
      ],
      "bounded_non_goals": [
        "does not claim every summary is equally authoritative",
        "does not replace live validator behavior with prose"
      ]
    },
    {
      "id": "synthetic-public-safe-examples",
      "summary": "Examples are synthetic and public-safe instead of copied from private vault data.",
      "rationale": "Synthetic examples preserve explainability and verification value without leaking personal data, internal plans, or private graph state.",
      "strongest_surfaces": [
        "examples/example-note.capsule.json",
        "examples/example-task.capsule.json",
        "PUBLIC_EXAMPLE_COVERAGE.json",
        "PUBLIC_FAILURE_MODEL.json"
      ],
      "supporting_surfaces": [
        "docs/examples.md",
        "docs/failure-model.md",
        "PUBLIC_RELEASE_REVIEW.md"
      ],
      "verify_commands": [
        "npm run check:examples",
        "npm run check:example-coverage",
        "npm run check:decision-log"
      ],
      "bounded_non_goals": [
        "does not claim examples are real user data",
        "does not expose private vault contents for realism"
      ]
    },
    {
      "id": "machine-readable-reviewer-layers",
      "summary": "The repository publishes many machine-readable reviewer layers instead of relying only on prose docs.",
      "rationale": "Structured reviewer surfaces make public maturity, evidence, coverage, and limits testable instead of subjective.",
      "strongest_surfaces": [
        "PUBLIC_PROJECT_PROFILE.json",
        "PUBLIC_EVALUATION_PACKET.json",
        "PUBLIC_REVIEW_SCORECARD.json",
        "PUBLIC_VERIFICATION_MATRIX.json"
      ],
      "supporting_surfaces": [
        "docs/reviewer-guide.md",
        "docs/evaluation-packet.md",
        "docs/review-scorecard.md"
      ],
      "verify_commands": [
        "npm run check:project-profile",
        "npm run check:evaluation-packet",
        "npm run check:review-scorecard",
        "npm run check:decision-log"
      ],
      "bounded_non_goals": [
        "does not claim that machine-readable summaries replace stronger contracts",
        "does not claim reviewer convenience is more important than source integrity"
      ]
    },
    {
      "id": "portability-and-no-lock-in-via-public-contracts",
      "summary": "Portability and no-lock-in are expressed through public contracts, not only through marketing language.",
      "rationale": "Trust grows when portability is tied to visible archive/schema surfaces and explicit non-goals instead of slogans.",
      "strongest_surfaces": [
        "docs/portability.md",
        "PUBLIC_PORTABILITY_PROFILE.json",
        "schemas/archive-bundle.schema.json",
        "PUBLIC_LIMITATIONS_REGISTER.json"
      ],
      "supporting_surfaces": [
        "docs/archive-bundles.md",
        "docs/trust-model.md",
        "PUBLIC_ECOSYSTEM_VALUE_MAP.json"
      ],
      "verify_commands": [
        "npm run check:portability",
        "npm run check:limitations-register",
        "npm run check:decision-log"
      ],
      "bounded_non_goals": [
        "does not claim a hosted export/import service already exists",
        "does not claim runtime portability beyond published contracts"
      ]
    },
    {
      "id": "release-verified-projection-discipline",
      "summary": "The public projection is maintained through provenance, release evidence, and repo-local verification rather than ad hoc exports.",
      "rationale": "A public trust artifact remains credible only if release discipline and projection discipline are visible and repeatable.",
      "strongest_surfaces": [
        "SOURCE_MANIFEST.json",
        "PUBLIC_RELEASE_METADATA.json",
        "PUBLIC_UPDATE_COHERENCE_MAP.json",
        "PUBLIC_EVIDENCE_TIMELINE.json"
      ],
      "supporting_surfaces": [
        "docs/release-evidence.md",
        "docs/maintainer-operations.md",
        "docs/verification.md"
      ],
      "verify_commands": [
        "npm run check:release",
        "npm run check:update-coherence",
        "npm run check:decision-log"
      ],
      "bounded_non_goals": [
        "does not claim zero drift without ongoing maintenance",
        "does not expose private maintainer workflows as public doctrine"
      ]
    }
  ],
  "non_claims": [
    "This file does not claim to capture every internal historical discussion or unpublished runtime decision.",
    "This file does not replace stronger contracts, provenance, release evidence, or live validator behavior."
  ],
  "review_commands": [
    "npm run check:decision-log",
    "npm run verify:repo"
  ]
}
